{
  "metadata": {
    "schemaVersion": 1,
    "metric": "onchain-total-supply-value-native",
    "asOf": "2026-10-17T07:37:59Z",
    "contentDigest": "a694e5d19d1bb89af6d591b5d9a8303cc7d606a64a5d1c7a7b23cec5910dc36c",
    "status": "partial",
    "coverage": [
      {
        "chainId": "eip155:1",
        "totalDeployments": 34,
        "rankedDeployments": 9,
        "unrankedDeployments": 25,
        "observedAt": "2026-10-17T07:37:59Z"
      },
      {
        "chainId": "eip155:43114",
        "totalDeployments": 17,
        "rankedDeployments": 0,
        "unrankedDeployments": 17,
        "observedAt": "2026-10-17T07:53:53Z"
      },
      {
        "chainId": "solana:5eykt4UsFv8P8NJdTREpY1vzqKqZKvdp",
        "totalDeployments": 19,
        "rankedDeployments": 1,
        "unrankedDeployments": 18,
        "observedAt": "2026-10-17T07:53:54Z"
      }
    ],
    "sourceIds": [
      "rpc-avalanche-c-mainnet",
      "rpc-ethereum-mainnet",
      "rpc-solana-mainnet"
    ]
  },
  "records": [
    {
      "rank": 1,
      "chainId": "eip155:1",
      "deploymentIds": [
        "deployment-0014"
      ],
      "metric": "onchain-total-supply-value-native",
      "valueNumerator": "130641016429302266351466170786045132760",
      "valueDenominator": "3595077537149",
      "quoteCurrency": "native",
      "quoteDeploymentId": "deployment-0001",
      "observedAt": "2026-10-17T07:37:59Z",
      "sourceId": "rpc-ethereum-mainnet",
      "sourceAssetId": null
    },
    {
      "rank": 2,
      "chainId": "eip155:1",
      "deploymentIds": [
        "deployment-0008"
      ],
      "metric": "onchain-total-supply-value-native",
      "valueNumerator": "98736692628347299182620625545326511078",
      "valueDenominator": "4979903281723",
      "quoteCurrency": "native",
      "quoteDeploymentId": "deployment-0001",
      "observedAt": "2026-10-17T07:37:59Z",
      "sourceId": "rpc-ethereum-mainnet",
      "sourceAssetId": null
    },
    {
      "rank": 3,
      "chainId": "eip155:1",
      "deploymentIds": [
        "deployment-0057"
      ],
      "metric": "onchain-total-supply-value-native",
      "valueNumerator": "7236559146328053431350000000000000000000000000",
      "valueDenominator": "1433062030979972172679",
      "quoteCurrency": "native",
      "quoteDeploymentId": "deployment-0001",
      "observedAt": "2026-10-17T07:37:59Z",
      "sourceId": "rpc-ethereum-mainnet",
      "sourceAssetId": null
    },
    {
      "rank": 4,
      "chainId": "eip155:1",
      "deploymentIds": [
        "discovered-token-e375086901067fe3de023bcdc70f1bafca798e1719ed7e676a98f57de3350a07"
      ],
      "metric": "onchain-total-supply-value-native",
      "valueNumerator": "20835107308352283506803868798879856",
      "valueDenominator": "5344583777",
      "quoteCurrency": "native",
      "quoteDeploymentId": "deployment-0001",
      "observedAt": "2026-10-17T07:37:59Z",
      "sourceId": "rpc-ethereum-mainnet",
      "sourceAssetId": null
    },
    {
      "rank": 5,
      "chainId": "eip155:1",
      "deploymentIds": [
        "deployment-0019"
      ],
      "metric": "onchain-total-supply-value-native",
      "valueNumerator": "2800942983229949453336991607338877858936978839652",
      "valueDenominator": "1504723349653765694239441",
      "quoteCurrency": "native",
      "quoteDeploymentId": "deployment-0001",
      "observedAt": "2026-10-17T07:37:59Z",
      "sourceId": "rpc-ethereum-mainnet",
      "sourceAssetId": null
    },
    {
      "rank": 6,
      "chainId": "eip155:1",
      "deploymentIds": [
        "discovered-token-69519fd08e31445cad84b0c17a5346b7ee9c5692e270602af9308ca6d8943bb6"
      ],
      "metric": "onchain-total-supply-value-native",
      "valueNumerator": "6700435926079874505750000000000000000000000000",
      "valueDenominator": "53500225987707179501507",
      "quoteCurrency": "native",
      "quoteDeploymentId": "deployment-0001",
      "observedAt": "2026-10-17T07:37:59Z",
      "sourceId": "rpc-ethereum-mainnet",
      "sourceAssetId": null
    },
    {
      "rank": 7,
      "chainId": "eip155:1",
      "deploymentIds": [
        "discovered-token-054d80a64e1f36a756129763ca2f1e7a140b50b04c83876ff01dd5fd497a74c5"
      ],
      "metric": "onchain-total-supply-value-native",
      "valueNumerator": "9237136531030808419360012793170213095602108464",
      "valueDenominator": "116083146145420639424437",
      "quoteCurrency": "native",
      "quoteDeploymentId": "deployment-0001",
      "observedAt": "2026-10-17T07:37:59Z",
      "sourceId": "rpc-ethereum-mainnet",
      "sourceAssetId": null
    },
    {
      "rank": 8,
      "chainId": "eip155:1",
      "deploymentIds": [
        "discovered-token-b475569f6a15e97ac04e531dd813e9dcc902521c098d60d6ae4d21d53baf1395"
      ],
      "metric": "onchain-total-supply-value-native",
      "valueNumerator": "5911603153031796490365705307861828293630394",
      "valueDenominator": "106102311205603960081",
      "quoteCurrency": "native",
      "quoteDeploymentId": "deployment-0001",
      "observedAt": "2026-10-17T07:37:59Z",
      "sourceId": "rpc-ethereum-mainnet",
      "sourceAssetId": null
    },
    {
      "rank": 9,
      "chainId": "eip155:1",
      "deploymentIds": [
        "discovered-token-611597bd13daa43d01a23caa9cca6a98797c64be7fb5b2677370ddbcdeaf01ec"
      ],
      "metric": "onchain-total-supply-value-native",
      "valueNumerator": "113673456626124130001967868459101511904",
      "valueDenominator": "7060542069375113",
      "quoteCurrency": "native",
      "quoteDeploymentId": "deployment-0001",
      "observedAt": "2026-10-17T07:37:59Z",
      "sourceId": "rpc-ethereum-mainnet",
      "sourceAssetId": null
    },
    {
      "rank": 1,
      "chainId": "solana:5eykt4UsFv8P8NJdTREpY1vzqKqZKvdp",
      "deploymentIds": [
        "deployment-0013"
      ],
      "metric": "onchain-total-supply-value-native",
      "valueNumerator": "35736183627786031145445030628065462175541072920313856",
      "valueDenominator": "31642119916412934743534713685881673449",
      "quoteCurrency": "native",
      "quoteDeploymentId": "deployment-0005",
      "observedAt": "2026-10-17T07:53:54Z",
      "sourceId": "rpc-solana-mainnet",
      "sourceAssetId": null
    }
  ],
  "unranked": [
    {
      "chainId": "eip155:43114",
      "deploymentId": "deployment-0004",
      "reason": "unavailable",
      "sourceId": "rpc-avalanche-c-mainnet",
      "observedAt": "2026-10-17T07:53:53Z"
    },
    {
      "chainId": "eip155:43114",
      "deploymentId": "deployment-0009",
      "reason": "unavailable",
      "sourceId": "rpc-avalanche-c-mainnet",
      "observedAt": "2026-10-17T07:53:53Z"
    },
    {
      "chainId": "eip155:43114",
      "deploymentId": "deployment-0012",
      "reason": "unavailable",
      "sourceId": "rpc-avalanche-c-mainnet",
      "observedAt": "2026-10-17T07:53:53Z"
    },
    {
      "chainId": "eip155:43114",
      "deploymentId": "deployment-0015",
      "reason": "unavailable",
      "sourceId": "rpc-avalanche-c-mainnet",
      "observedAt": "2026-10-17T07:53:53Z"
    },
    {
      "chainId": "eip155:43114",
      "deploymentId": "deployment-0030",
      "reason": "unavailable",
      "sourceId": "rpc-avalanche-c-mainnet",
      "observedAt": "2026-10-17T07:53:53Z"
    },
    {
      "chainId": "eip155:43114",
      "deploymentId": "deployment-0035",
      "reason": "unavailable",
      "sourceId": "rpc-avalanche-c-mainnet",
      "observedAt": "2026-10-17T07:53:53Z"
    },
    {
      "chainId": "eip155:43114",
      "deploymentId": "deployment-0039",
      "reason": "unavailable",
      "sourceId": "rpc-avalanche-c-mainnet",
      "observedAt": "2026-10-17T07:53:53Z"
    },
    {
      "chainId": "eip155:43114",
      "deploymentId": "deployment-0045",
      "reason": "unavailable",
      "sourceId": "rpc-avalanche-c-mainnet",
      "observedAt": "2026-10-17T07:53:53Z"
    },
    {
      "chainId": "eip155:43114",
      "deploymentId": "deployment-0058",
      "reason": "unavailable",
      "sourceId": "rpc-avalanche-c-mainnet",
      "observedAt": "2026-10-17T07:53:53Z"
    },
    {
      "chainId": "eip155:43114",
      "deploymentId": "deployment-0059",
      "reason": "unavailable",
      "sourceId": "rpc-avalanche-c-mainnet",
      "observedAt": "2026-10-17T07:53:53Z"
    },
    {
      "chainId": "eip155:43114",
      "deploymentId": "discovered-token-0a7f98c8752f15ee02ce0d801f25df8ff78864a1d70aff7e204f7bdb3f8a0692",
      "reason": "unavailable",
      "sourceId": "rpc-avalanche-c-mainnet",
      "observedAt": "2026-10-17T07:53:53Z"
    },
    {
      "chainId": "eip155:43114",
      "deploymentId": "discovered-token-1847342426b765add3c8b4feb724c6b15121f25097cb7917c967c285ca77e804",
      "reason": "unavailable",
      "sourceId": "rpc-avalanche-c-mainnet",
      "observedAt": "2026-10-17T07:53:53Z"
    },
    {
      "chainId": "eip155:43114",
      "deploymentId": "discovered-token-288036a90ee0fa72a2751a78a6934cc6ced9e16de91c97ae8e109e2ee6189bc5",
      "reason": "unavailable",
      "sourceId": "rpc-avalanche-c-mainnet",
      "observedAt": "2026-10-17T07:53:53Z"
    },
    {
      "chainId": "eip155:43114",
      "deploymentId": "discovered-token-323d07c442f0d089197ae7eea9b3ebb829910177c5b780161a7623aaed5e4371",
      "reason": "unavailable",
      "sourceId": "rpc-avalanche-c-mainnet",
      "observedAt": "2026-10-17T07:53:53Z"
    },
    {
      "chainId": "eip155:43114",
      "deploymentId": "discovered-token-9f9965cc065c9becf8d2cb58071524baafea37d27fda9bf683a93ea85f2e653d",
      "reason": "unavailable",
      "sourceId": "rpc-avalanche-c-mainnet",
      "observedAt": "2026-10-17T07:53:53Z"
    },
    {
      "chainId": "eip155:1",
      "deploymentId": "deployment-0001",
      "reason": "excluded-native",
      "sourceId": "rpc-ethereum-mainnet",
      "observedAt": null
    },
    {
      "chainId": "eip155:1",
      "deploymentId": "deployment-0002",
      "reason": "unavailable",